[
  {
    "url": "https://bdjobs.com/h/details/1458119?ln=1",
    "company_name": "The Radius International School",
    "job_title": "Teacher (Physics/ Chemistry/ Mathematics)",
    "location": "Dhaka (Uttara Sector 13)",
    "salary": "Negotiable",
    "experience": "",
    "education": null,
    "deadline": "19 Feb 2026",
    "job_description": "Teacher (Physics/ Chemistry/ Mathematics) : The Radius International School Jobs ENG বাংলা Create Account Sign In For Employer Create Sign In Home Jobs Mybdjobs Job List The Radius International School Teacher (Physics/ Chemistry/ Mathematics) Application Deadline : 19 Feb 2026 Apply Now Shortlist Share: Facebook LinkedIn WhatsApp All Requirements Responsibilities Skills & Expertise Company Information Summary Vacancy: 2 Location: Dhaka (Uttara Sector 13) Salary: Negotiable Published: 09 Feb 2026 To access Application Insights Get Bdjobs Pro Requirements Education Experience Additional Requirements Capable of teaching up to O/A Level. Minimum 3 years’ of teaching experience in English Medium Schools. Responsibilities & Context Skills & Expertise Cambridge Curriculum Experience in English Medium School teaching english medium students Suggested by Education Teaching Teaching/ Training Employment Status Full Time Job Location Dhaka (Uttara Sector 13) Company Information The Radius International School Follow Address: House# 12, Road# 19, Sector# 13, Uttara, Dhaka 1230 Business: English Medium School from Play Group to A Level Report this Job / Company (রিপোর্ট) রিপোর্ট এই চাকরির জন্য বিজ্ঞাপনদাতা ব্যাক্তি/প্রতিষ্ঠান আপনার কাছ থেকে কোন অর্থ চাইলে কিংবা নিয়োগ প্রক্রিয়া চলাকালীন কোন প্রকার হয়রানিমূলক (শারীরিক/মানসিক) আচরণ করলে অতিসত্ত্বর আমাদেরকে জানান অথবা জবটি রিপোর্ট করুন। চাকরি পাওয়ার জন্য কোন ব্যাক্তি/প্রতিষ্ঠানকে অর্থ প্রদান করবেন না। চাকরিকালীন কোন প্রকার হয়রানির (শারীরিক/মানসিক) সম্ভাবনা থাকলে সেখানে জয়েন করবেন না। কোন প্রকার অর্থ লেনদেন বা নিয়োগদাতা কর্তৃক হয়রানির দায়িত্ব বিডিজবস বহন করবে না। 09638666444 , 01897627858 complain@bdjobs.com ⏸ Project Cycle Management (PCM) for the NGO Professionals 4500 BDT Tareq Ahmed Register Now Lean Six Sigma-Yellow Belt 3500 BDT Engr. Md. Towhid Ul Alam Chowdhury Register Now ইন্টারভিউয়ের কল পেতে ফ্রিতে রেজিস্ট্রেশন করুন Employability Skills Course FREE! BDT Self-paced Learning Register Now Project Cycle Management (PCM) for the NGO Professionals 4500 BDT Tareq Ahmed Register Now Lean Six Sigma-Yellow Belt 3500 BDT Engr. Md. Towhid Ul Alam Chowdhury Register Now ইন্টারভিউয়ের কল পেতে ফ্রিতে রেজিস্ট্রেশন করুন Employability Skills Course FREE! BDT Self-paced Learning Register Now Need any support? Our Contact Centre is available from -9 am to 8 pm (Sat to Thurs). 09638666444 01897627858 About Us About Bdjobs.com Terms & Conditions Privacy Policy Feedback Contact Us Accessibility Statement Job Seekers Bdjobs Pro My Bdjobs Panel List of Features Video Guides FAQ Recruiter Create Account Products/Service Post a Job FAQ Download Job Seeker App Get real-time job updates on our app. Download Employer App Post jobs and manage hiring anytime. Our Valuable Partners Stay connected with us Close"
  }
]